{
  "api_version": "apg/v0",
  "kind": "RunRecord",
  "run_id": "baseline_lane_change_cut_in_001_dry_run",
  "experiment": "autoware_baseline",
  "benchmark": "lane_change_cut_in_001",
  "mode": "baseline",
  "git": {
    "autoware_playground": null,
    "autoware_universe": null
  },
  "runtime": {
    "container_digest": null,
    "ros_distro": "not_executed"
  },
  "assets": {
    "map_sha256": "0000000000000000000000000000000000000000000000000000000000000000",
    "scenario_sha256": "2222222222222222222222222222222222222222222222222222222222222222"
  },
  "metrics": {
    "dry_run": true
  },
  "failures": [
    "sim_invalid"
  ],
  "artifacts": {
    "rosbag": null,
    "report": null,
    "plots": null
  },
  "execution": {
    "status": "not_executed",
    "dry_run": true
  },
  "reproduce": "apg run benchmarks/planning/lane_change_cut_in_001 --experiment experiments/planning/autoware_baseline --dry-run"
}
