{
  "api_version": "apg/v0",
  "artifacts": {
    "failure_cards": null,
    "plots": null,
    "report": null,
    "rosbag": "tools/scripts/make_sample_rosbag.py"
  },
  "assets": {
    "map_sha256": "0000000000000000000000000000000000000000000000000000000000000000",
    "rosbag_sha256": "1111111111111111111111111111111111111111111111111111111111111111"
  },
  "benchmark": "lidar_localization_replay_001",
  "execution": {
    "baseline_status": "real",
    "dry_run": false,
    "seed": 42,
    "status": "completed"
  },
  "experiment": "ndt_baseline",
  "failures": [],
  "git": {
    "autoware_playground": "8047157",
    "autoware_universe": null
  },
  "kind": "RunRecord",
  "metrics": {
    "convergence_time_sec": null,
    "no_localization_lost": null,
    "play_elapsed_sec": 1.457,
    "play_returncode": 0,
    "play_timed_out": false,
    "pose_jump_count": null,
    "pose_output_available": null,
    "rosbag_duration_sec": 0.9,
    "rosbag_message_count": 5,
    "rosbag_topic_count": 1
  },
  "mode": "offline_replay",
  "reproduce": "apg run benchmarks/localization/lidar_localization_replay_001 --experiment experiments/localization/ndt_baseline --headless",
  "run_id": "baseline_lidar_localization_replay_001_ndt_baseline_real",
  "runtime": {
    "container_digest": null,
    "headless": true,
    "preflight": {
      "checks": [
        {
          "detail": "jazzy",
          "name": "ROS_DISTRO",
          "ok": true
        },
        {
          "detail": "/opt/ros/jazzy/bin/ros2",
          "name": "ros2",
          "ok": true
        }
      ],
      "ok": true,
      "runner": "rosbag_replay"
    },
    "ros_distro": "jazzy",
    "runner": "rosbag_replay",
    "runner_hints": {
      "backend": "rosbag_replay",
      "dispatched": true,
      "executed": true,
      "experiment_mode": "offline_replay",
      "headless": true,
      "rosbag_source": "tools/scripts/make_sample_rosbag.py",
      "seed": null,
      "timeout_sec": 120
    },
    "source": "github_actions:smoke#real-rosbag-replay run 26278498200"
  }
}
